[
  {
    "slug": "assemblyai/universal-3-5-pro",
    "provider": "assemblyai",
    "name": "AssemblyAI Universal-3.5 Pro",
    "kind": "stt",
    "modes": ["streaming"],
    "pricing": { "per_second_usd": 0.000125 },
    "capabilities": {
      "diarization": true,
      "word_timestamps": true,
      "interim_results": true,
      "endpointing": true,
      "keyword_boosting": true,
      "languages": ["auto"],
      "encodings": ["linear16", "mulaw", "opus", "ogg-opus"],
      "sample_rates": [8000, 16000, 24000, 44100, 48000]
    },
    "hipaa_eligible": true
  },
  {
    "slug": "assemblyai/universal-streaming-english",
    "provider": "assemblyai",
    "name": "AssemblyAI Universal-Streaming (English)",
    "kind": "stt",
    "modes": ["streaming"],
    "pricing": { "per_second_usd": 0.0000417 },
    "capabilities": {
      "diarization": true,
      "word_timestamps": true,
      "interim_results": true,
      "endpointing": true,
      "keyword_boosting": true,
      "languages": ["en"],
      "encodings": ["linear16", "mulaw", "opus", "ogg-opus"],
      "sample_rates": [8000, 16000, 24000, 44100, 48000]
    },
    "hipaa_eligible": true
  },
  {
    "slug": "assemblyai/universal-2",
    "provider": "assemblyai",
    "name": "AssemblyAI Universal-2 (batch)",
    "kind": "stt",
    "modes": ["batch"],
    "pricing": { "per_second_usd": 0.0000583 },
    "capabilities": {
      "diarization": true,
      "word_timestamps": true,
      "keyword_boosting": true,
      "languages": ["auto"]
    },
    "hipaa_eligible": true
  }
]
