[
  {
    "slug": "soniox/stt-rt-v5",
    "provider": "soniox",
    "name": "Soniox STT Realtime v5",
    "kind": "stt",
    "modes": [
      "streaming"
    ],
    "pricing": {
      "per_session_hour_usd": 0.12
    },
    "capabilities": {
      "diarization": true,
      "word_timestamps": true,
      "interim_results": true,
      "endpointing": true,
      "keyword_boosting": true,
      "languages": [
        "auto",
        "af",
        "sq",
        "ar",
        "az",
        "eu",
        "be",
        "bn",
        "bs",
        "bg",
        "ca",
        "zh",
        "hr",
        "cs",
        "da",
        "nl",
        "en",
        "et",
        "fi",
        "fr",
        "gl",
        "de",
        "el",
        "gu",
        "he",
        "hi",
        "hu",
        "id",
        "it",
        "ja",
        "kn",
        "kk",
        "ko",
        "lv",
        "lt",
        "mk",
        "ms",
        "ml",
        "mr",
        "no",
        "fa",
        "pl",
        "pt",
        "pa",
        "ro",
        "ru",
        "sr",
        "sk",
        "sl",
        "es",
        "sw",
        "sv",
        "tl",
        "ta",
        "te",
        "th",
        "tr",
        "uk",
        "ur",
        "vi",
        "cy"
      ],
      "encodings": [
        "linear16",
        "linear32",
        "mulaw",
        "alaw"
      ],
      "sample_rates": [
        8000,
        16000,
        24000,
        44100,
        48000
      ],
      "language_hints": true
    },
    "hipaa_eligible": true
  },
  {
    "slug": "soniox/stt-async-v5",
    "provider": "soniox",
    "name": "Soniox STT Async v5",
    "kind": "stt",
    "modes": [
      "batch"
    ],
    "pricing": {
      "per_audio_hour_usd": 0.1
    },
    "capabilities": {
      "diarization": true,
      "word_timestamps": true,
      "keyword_boosting": true,
      "languages": [
        "auto",
        "af",
        "sq",
        "ar",
        "az",
        "eu",
        "be",
        "bn",
        "bs",
        "bg",
        "ca",
        "zh",
        "hr",
        "cs",
        "da",
        "nl",
        "en",
        "et",
        "fi",
        "fr",
        "gl",
        "de",
        "el",
        "gu",
        "he",
        "hi",
        "hu",
        "id",
        "it",
        "ja",
        "kn",
        "kk",
        "ko",
        "lv",
        "lt",
        "mk",
        "ms",
        "ml",
        "mr",
        "no",
        "fa",
        "pl",
        "pt",
        "pa",
        "ro",
        "ru",
        "sr",
        "sk",
        "sl",
        "es",
        "sw",
        "sv",
        "tl",
        "ta",
        "te",
        "th",
        "tr",
        "uk",
        "ur",
        "vi",
        "cy"
      ]
    },
    "hipaa_eligible": true
  }
]
