[
  {
    "slug": "azure/fast-transcription",
    "provider": "azure",
    "name": "Azure AI Speech Fast Transcription",
    "kind": "stt",
    "modes": [
      "batch"
    ],
    "pricing": {
      "per_audio_hour_usd": 0.36
    },
    "capabilities": {
      "word_timestamps": true,
      "diarization": true,
      "keyword_boosting": true,
      "languages": [
        "auto",
        "en-US",
        "en-GB",
        "en-AU",
        "en-CA",
        "en-IN",
        "en-IE",
        "en-NZ",
        "es-ES",
        "es-MX",
        "es-US",
        "es-AR",
        "es-CO",
        "fr-FR",
        "fr-CA",
        "de-DE",
        "de-AT",
        "de-CH",
        "it-IT",
        "pt-BR",
        "pt-PT",
        "nl-NL",
        "nl-BE",
        "ja-JP",
        "ko-KR",
        "zh-CN",
        "zh-TW",
        "zh-HK",
        "ru-RU",
        "ar-SA",
        "ar-EG",
        "ar-AE",
        "hi-IN",
        "tr-TR",
        "pl-PL",
        "sv-SE",
        "da-DK",
        "nb-NO",
        "fi-FI",
        "el-GR",
        "cs-CZ",
        "hu-HU",
        "ro-RO",
        "uk-UA",
        "he-IL",
        "th-TH",
        "vi-VN",
        "id-ID",
        "ms-MY",
        "ta-IN",
        "te-IN"
      ],
      "max_audio_seconds": 18000
    },
    "hipaa_eligible": true
  },
  {
    "slug": "azure/mai-transcribe-2",
    "provider": "azure",
    "name": "MAI-Transcribe-2",
    "kind": "stt",
    "modes": [
      "batch"
    ],
    "pricing": {
      "per_audio_hour_usd": 0.1
    },
    "capabilities": {
      "word_timestamps": true,
      "diarization": true,
      "keyword_boosting": true,
      "languages": [
        "auto",
        "af",
        "ar",
        "as",
        "az",
        "bg",
        "bn",
        "bs",
        "ca",
        "cs",
        "da",
        "de",
        "el",
        "en",
        "es",
        "et",
        "fa",
        "fi",
        "fil",
        "fr",
        "gl",
        "gu",
        "he",
        "hi",
        "hu",
        "hy",
        "id",
        "is",
        "it",
        "ja",
        "kk",
        "kn",
        "ko",
        "lt",
        "lv",
        "mk",
        "ml",
        "mr",
        "ms",
        "nb",
        "ne",
        "nl",
        "or",
        "pa",
        "pl",
        "pt",
        "ro",
        "ru",
        "sk",
        "sl",
        "sv",
        "sw",
        "ta",
        "te",
        "th",
        "tr",
        "uk",
        "ur",
        "vi",
        "yue",
        "zh"
      ],
      "max_audio_seconds": 7200
    }
  },
  {
    "slug": "azure/mai-transcribe-1.5",
    "provider": "azure",
    "name": "MAI-Transcribe-1.5",
    "kind": "stt",
    "modes": [
      "batch"
    ],
    "pricing": {
      "per_audio_hour_usd": 0.36
    },
    "capabilities": {
      "word_timestamps": false,
      "diarization": false,
      "keyword_boosting": true,
      "languages": [
        "auto",
        "ar",
        "as",
        "bg",
        "bn",
        "ca",
        "cs",
        "da",
        "de",
        "el",
        "en",
        "es",
        "et",
        "fi",
        "fr",
        "gu",
        "hi",
        "hu",
        "id",
        "it",
        "ja",
        "kn",
        "ko",
        "lt",
        "ml",
        "mr",
        "nb",
        "nl",
        "or",
        "pa",
        "pl",
        "pt",
        "ro",
        "ru",
        "sk",
        "sl",
        "sv",
        "ta",
        "te",
        "th",
        "tr",
        "uk",
        "vi",
        "zh"
      ],
      "max_audio_seconds": 7200
    }
  },
  {
    "slug": "azure/speech-realtime",
    "provider": "azure",
    "name": "Azure Speech Realtime",
    "kind": "stt",
    "modes": [
      "streaming"
    ],
    "pricing": {
      "per_audio_hour_usd": 1.0
    },
    "capabilities": {
      "interim_results": true,
      "word_timestamps": true,
      "languages": [
        "auto",
        "en-US",
        "en-GB",
        "en-AU",
        "en-CA",
        "en-IN",
        "en-IE",
        "en-NZ",
        "es-ES",
        "es-MX",
        "es-US",
        "es-AR",
        "es-CO",
        "fr-FR",
        "fr-CA",
        "de-DE",
        "de-AT",
        "de-CH",
        "it-IT",
        "pt-BR",
        "pt-PT",
        "nl-NL",
        "nl-BE",
        "ja-JP",
        "ko-KR",
        "zh-CN",
        "zh-TW",
        "zh-HK",
        "ru-RU",
        "ar-SA",
        "ar-EG",
        "ar-AE",
        "hi-IN",
        "tr-TR",
        "pl-PL",
        "sv-SE",
        "da-DK",
        "nb-NO",
        "fi-FI",
        "el-GR",
        "cs-CZ",
        "hu-HU",
        "ro-RO",
        "uk-UA",
        "he-IL",
        "th-TH",
        "vi-VN",
        "id-ID",
        "ms-MY",
        "ta-IN",
        "te-IN"
      ],
      "encodings": [
        "linear16"
      ],
      "sample_rates": [
        8000,
        16000
      ],
      "diarization": false,
      "keyword_boosting": true
    }
  },
  {
    "slug": "azure/conversation-transcription",
    "provider": "azure",
    "name": "Azure Conversation Transcription",
    "kind": "stt",
    "modes": [
      "streaming"
    ],
    "pricing": {
      "per_audio_hour_usd": 1.2
    },
    "capabilities": {
      "interim_results": true,
      "word_timestamps": true,
      "languages": [
        "auto",
        "en-US",
        "en-GB",
        "en-AU",
        "en-CA",
        "en-IN",
        "en-IE",
        "en-NZ",
        "es-ES",
        "es-MX",
        "es-US",
        "es-AR",
        "es-CO",
        "fr-FR",
        "fr-CA",
        "de-DE",
        "de-AT",
        "de-CH",
        "it-IT",
        "pt-BR",
        "pt-PT",
        "nl-NL",
        "nl-BE",
        "ja-JP",
        "ko-KR",
        "zh-CN",
        "zh-TW",
        "zh-HK",
        "ru-RU",
        "ar-SA",
        "ar-EG",
        "ar-AE",
        "hi-IN",
        "tr-TR",
        "pl-PL",
        "sv-SE",
        "da-DK",
        "nb-NO",
        "fi-FI",
        "el-GR",
        "cs-CZ",
        "hu-HU",
        "ro-RO",
        "uk-UA",
        "he-IL",
        "th-TH",
        "vi-VN",
        "id-ID",
        "ms-MY",
        "ta-IN",
        "te-IN"
      ],
      "encodings": [
        "linear16"
      ],
      "sample_rates": [
        8000,
        16000
      ],
      "diarization": true
    }
  },
  {
    "slug": "azure/neural",
    "provider": "azure",
    "name": "Azure Neural TTS",
    "kind": "tts",
    "modes": [
      "streaming",
      "batch"
    ],
    "pricing": {
      "per_character_usd": 1.5e-05
    },
    "pricing_source": "https://prices.azure.com/api/retail/prices (Azure Speech, eastus: 'S1 Neural Text To Speech Characters', 'Neural HD Text to Speech Characters')",
    "pricing_checked": "2026-10-13",
    "capabilities": {
      "voices": [
        "en-US-JennyNeural",
        "en-US-JennyMultilingualNeural",
        "en-US-ChristopherNeural",
        "en-US-AvaMultilingualNeural"
      ],
      "default_voice": "en-US-JennyNeural",
      "custom_voices": true,
      "formats": [
        "pcm",
        "wav",
        "mp3",
        "opus",
        "mulaw",
        "alaw"
      ],
      "output_sample_rates": [
        8000,
        16000,
        24000,
        48000
      ],
      "max_input_chars": 5000,
      "instructions": false,
      "speed": true,
      "languages": [
        "auto"
      ]
    },
    "notes": "500+ voices across locales via /cognitiveservices/voices/list"
  },
  {
    "slug": "azure/neural-hd",
    "provider": "azure",
    "name": "Azure Neural HD (Dragon HD)",
    "kind": "tts",
    "modes": [
      "streaming",
      "batch"
    ],
    "pricing": {
      "per_character_usd": 2.2e-05
    },
    "pricing_source": "https://prices.azure.com/api/retail/prices (Azure Speech, eastus: 'S1 Neural Text To Speech Characters', 'Neural HD Text to Speech Characters')",
    "pricing_checked": "2026-10-13",
    "capabilities": {
      "voices": [
        "en-US-Ava:DragonHDLatestNeural",
        "en-US-Andrew:DragonHDLatestNeural",
        "en-US-Andrew2:DragonHDLatestNeural",
        "en-US-Aria:DragonHDLatestNeural",
        "en-US-Brian:DragonHDLatestNeural",
        "en-US-Davis:DragonHDLatestNeural",
        "en-US-Emma:DragonHDLatestNeural",
        "en-US-Emma2:DragonHDLatestNeural",
        "en-US-Jenny:DragonHDLatestNeural",
        "en-US-Nova:DragonHDLatestNeural",
        "en-US-Phoebe:DragonHDLatestNeural",
        "en-US-Serena:DragonHDLatestNeural"
      ],
      "default_voice": "en-US-Ava:DragonHDLatestNeural",
      "custom_voices": true,
      "formats": [
        "pcm",
        "wav",
        "mp3",
        "opus",
        "mulaw",
        "alaw"
      ],
      "output_sample_rates": [
        8000,
        16000,
        24000,
        48000
      ],
      "max_input_chars": 5000,
      "instructions": false,
      "speed": true,
      "languages": [
        "auto"
      ]
    },
    "notes": "Dragon HD voices are region-limited: the house resource (westus) lists none, so requests fail until an HD-capable region resource is configured (verified live 2026-10-13)"
  }
]
