[
  {
    "slug": "deepgram/nova-3",
    "provider": "deepgram",
    "name": "Deepgram Nova-3",
    "kind": "stt",
    "modes": [
      "streaming",
      "batch"
    ],
    "pricing": {
      "per_audio_minute_usd": 0.0048
    },
    "capabilities": {
      "diarization": true,
      "word_timestamps": true,
      "interim_results": true,
      "endpointing": true,
      "keyword_boosting": true,
      "languages": [
        "auto",
        "multi",
        "en",
        "en-US",
        "en-AU",
        "en-GB",
        "en-IN",
        "en-NZ",
        "es",
        "es-419",
        "fr",
        "fr-CA",
        "de",
        "de-CH",
        "hi",
        "ru",
        "pt",
        "pt-BR",
        "pt-PT",
        "ja",
        "it",
        "nl",
        "nl-BE",
        "ar",
        "be",
        "bn",
        "bs",
        "bg",
        "ca",
        "zh",
        "zh-CN",
        "zh-TW",
        "zh-HK",
        "hr",
        "cs",
        "da",
        "et",
        "fi",
        "el",
        "gu",
        "he",
        "hu",
        "id",
        "kn",
        "ko",
        "lv",
        "lt",
        "mk",
        "ms",
        "mr",
        "no",
        "fa",
        "pl",
        "ro",
        "sr",
        "sk",
        "sl",
        "sv",
        "tl",
        "ta",
        "te",
        "th",
        "tr",
        "uk",
        "ur",
        "vi"
      ],
      "encodings": [
        "linear16",
        "linear32",
        "mulaw",
        "alaw",
        "opus",
        "ogg-opus",
        "flac"
      ],
      "sample_rates": [
        8000,
        16000,
        24000,
        44100,
        48000
      ]
    },
    "hipaa_eligible": true
  },
  {
    "slug": "deepgram/nova-3-medical",
    "provider": "deepgram",
    "name": "Deepgram Nova-3 Medical",
    "kind": "stt",
    "modes": [
      "streaming",
      "batch"
    ],
    "pricing": {
      "per_audio_minute_usd": 0.0048
    },
    "capabilities": {
      "diarization": true,
      "word_timestamps": true,
      "interim_results": true,
      "endpointing": true,
      "keyword_boosting": true,
      "languages": [
        "en",
        "en-US",
        "en-GB",
        "en-AU",
        "en-IN",
        "en-NZ"
      ],
      "encodings": [
        "linear16",
        "linear32",
        "mulaw",
        "alaw",
        "opus",
        "ogg-opus",
        "flac"
      ],
      "sample_rates": [
        8000,
        16000,
        24000,
        44100,
        48000
      ]
    },
    "hipaa_eligible": true
  },
  {
    "slug": "deepgram/nova-2",
    "provider": "deepgram",
    "name": "Deepgram Nova-2",
    "kind": "stt",
    "modes": [
      "streaming",
      "batch"
    ],
    "pricing": {
      "per_audio_minute_usd": 0.0048
    },
    "capabilities": {
      "diarization": true,
      "word_timestamps": true,
      "interim_results": true,
      "endpointing": true,
      "keyword_boosting": true,
      "languages": [
        "auto",
        "multi",
        "en",
        "en-US",
        "en-AU",
        "en-GB",
        "en-NZ",
        "en-IN",
        "es",
        "es-419",
        "bg",
        "ca",
        "zh",
        "zh-CN",
        "zh-TW",
        "zh-HK",
        "cs",
        "da",
        "nl",
        "nl-BE",
        "et",
        "fi",
        "fr",
        "fr-CA",
        "de",
        "de-CH",
        "el",
        "hi",
        "hu",
        "id",
        "it",
        "ja",
        "ko",
        "lv",
        "lt",
        "ms",
        "no",
        "pl",
        "pt",
        "pt-BR",
        "pt-PT",
        "ro",
        "ru",
        "sk",
        "sv",
        "th",
        "tr",
        "uk",
        "vi"
      ],
      "encodings": [
        "linear16",
        "linear32",
        "mulaw",
        "alaw",
        "opus",
        "ogg-opus",
        "flac"
      ],
      "sample_rates": [
        8000,
        16000,
        24000,
        44100,
        48000
      ]
    },
    "hipaa_eligible": true
  },
  {
    "slug": "deepgram/flux-general-en",
    "provider": "deepgram",
    "name": "Deepgram Flux (English)",
    "kind": "stt",
    "modes": [
      "streaming"
    ],
    "pricing": {
      "per_audio_minute_usd": 0.00648
    },
    "capabilities": {
      "word_timestamps": true,
      "interim_results": true,
      "endpointing": true,
      "keyword_boosting": true,
      "diarization": false,
      "languages": [
        "en"
      ],
      "encodings": [
        "linear16",
        "linear32",
        "mulaw",
        "alaw",
        "opus",
        "ogg-opus"
      ],
      "sample_rates": [
        8000,
        16000,
        24000,
        44100,
        48000
      ]
    }
  },
  {
    "slug": "deepgram/flux-general-multi",
    "provider": "deepgram",
    "name": "Deepgram Flux (Multilingual)",
    "kind": "stt",
    "modes": [
      "streaming"
    ],
    "pricing": {
      "per_audio_minute_usd": 0.0078
    },
    "capabilities": {
      "word_timestamps": true,
      "interim_results": true,
      "endpointing": true,
      "keyword_boosting": true,
      "diarization": false,
      "languages": [
        "multi",
        "en",
        "es",
        "fr",
        "de",
        "hi",
        "ru",
        "pt",
        "ja",
        "it",
        "nl"
      ],
      "encodings": [
        "linear16",
        "linear32",
        "mulaw",
        "alaw",
        "opus",
        "ogg-opus"
      ],
      "sample_rates": [
        8000,
        16000,
        24000,
        44100,
        48000
      ]
    }
  },
  {
    "slug": "deepgram/aura-2",
    "provider": "deepgram",
    "name": "Deepgram Aura-2",
    "kind": "tts",
    "modes": [
      "streaming",
      "batch"
    ],
    "pricing": {
      "per_character_usd": 3e-05
    },
    "pricing_source": "https://deepgram.com/pricing",
    "pricing_checked": "2026-10-13",
    "capabilities": {
      "voices": [
        "aura-2-thalia-en",
        "aura-2-andromeda-en",
        "aura-2-helena-en",
        "aura-2-apollo-en",
        "aura-2-arcas-en",
        "aura-2-aries-en",
        "aura-2-celeste-es",
        "aura-2-estrella-es",
        "aura-2-nestor-es",
        "aura-2-agathe-fr",
        "aura-2-hector-fr",
        "aura-2-julius-de",
        "aura-2-viktoria-de",
        "aura-2-livia-it",
        "aura-2-fujin-ja"
      ],
      "default_voice": "aura-2-thalia-en",
      "custom_voices": true,
      "formats": [
        "pcm",
        "wav",
        "mp3",
        "opus",
        "flac",
        "aac",
        "mulaw",
        "alaw"
      ],
      "output_sample_rates": [
        8000,
        16000,
        24000,
        32000,
        48000
      ],
      "max_input_chars": 2000,
      "instructions": false,
      "speed": false,
      "languages": [
        "auto"
      ]
    },
    "notes": "voice = Deepgram model id (aura-2-<name>-<lang>), ~90 voices"
  },
  {
    "slug": "deepgram/aura-1",
    "provider": "deepgram",
    "name": "Deepgram Aura",
    "kind": "tts",
    "modes": [
      "streaming",
      "batch"
    ],
    "pricing": {
      "per_character_usd": 1.5e-05
    },
    "pricing_source": "https://deepgram.com/pricing",
    "pricing_checked": "2026-10-13",
    "capabilities": {
      "voices": [
        "aura-asteria-en",
        "aura-luna-en",
        "aura-stella-en",
        "aura-athena-en",
        "aura-hera-en",
        "aura-orion-en",
        "aura-arcas-en",
        "aura-perseus-en",
        "aura-angus-en",
        "aura-orpheus-en",
        "aura-helios-en",
        "aura-zeus-en"
      ],
      "default_voice": "aura-asteria-en",
      "custom_voices": true,
      "formats": [
        "pcm",
        "wav",
        "mp3",
        "opus",
        "flac",
        "aac",
        "mulaw",
        "alaw"
      ],
      "output_sample_rates": [
        8000,
        16000,
        24000,
        32000,
        48000
      ],
      "max_input_chars": 2000,
      "instructions": false,
      "speed": false,
      "languages": [
        "auto"
      ]
    },
    "notes": "voice = Deepgram model id (aura-<name>-en)"
  },
  {
    "slug": "deepgram/flux",
    "provider": "deepgram",
    "name": "Deepgram Flux TTS",
    "kind": "tts",
    "modes": [
      "streaming",
      "batch"
    ],
    "pricing": {
      "per_character_usd": 4.5e-05
    },
    "pricing_source": "https://deepgram.com/pricing",
    "pricing_checked": "2026-10-13",
    "capabilities": {
      "voices": [
        "flux-hannah-en",
        "flux-kit-en",
        "flux-alexis-en",
        "flux-cliff-en",
        "flux-sienna-en",
        "flux-cole-en",
        "flux-brooke-en",
        "flux-colin-en",
        "flux-gemma-en",
        "flux-haley-en",
        "flux-heather-en",
        "flux-miles-en",
        "flux-sean-en",
        "flux-bree-en",
        "flux-brittany-en",
        "flux-bruce-en",
        "flux-conor-en",
        "flux-donovan-en",
        "flux-drew-en",
        "flux-elise-en"
      ],
      "default_voice": "flux-haley-en",
      "custom_voices": true,
      "formats": [
        "pcm",
        "wav",
        "mp3",
        "opus",
        "flac",
        "aac",
        "mulaw",
        "alaw"
      ],
      "output_sample_rates": [
        8000,
        16000,
        24000,
        32000,
        44100,
        48000
      ],
      "max_input_chars": 2000,
      "instructions": false,
      "speed": false,
      "languages": [
        "en"
      ]
    },
    "notes": "voice = Deepgram model id (flux-<name>-en, 36 voices); /v1/speak uses the native /v2/speak socket (Interrupt barge-in reports text_spoken/text_remaining) for pcm/mulaw/alaw"
  }
]
